{
  "$schema": "./v8-edge-catalog.schema.json",
  "catalogVersion": "v8.1",
  "generatedFrom": [
    "memory-enhanced/V8_ARCHITECTURE.md",
    "memory-enhanced/V8_SCHEMA_AND_PIPELINE.md",
    "memory-enhanced/V8_TYPES_AND_MIGRATION.md",
    "/mnt/d/E/deep-research-report.md"
  ],
  "notes": [
    "This catalog defines edge semantics and classification only.",
    "Runtime propagation policy is intentionally not encoded here.",
    "Compatibility aliases are retained for migration but are not canonical graph targets."
  ],
  "edges": [
    {
      "type": "is_a",
      "layer": "micro",
      "kind": "semantic",
      "group": "ontology",
      "status": "canonical",
      "description": "source is a subtype or kind of target",
      "sourceFamilies": [
        "MicroNode"
      ],
      "targetFamilies": [
        "MicroNode"
      ],
      "strength": null,
      "requiresScope": false,
      "stateful": false,
      "evidenceMode": "direct_or_support",
      "notes": ""
    },
    {
      "type": "instance_of",
      "layer": "micro",
      "kind": "semantic",
      "group": "ontology",
      "status": "canonical",
      "description": "source is a concrete instance of target class",
      "sourceFamilies": [
        "MicroNode"
      ],
      "targetFamilies": [
        "MicroNode"
      ],
      "strength": null,
      "requiresScope": false,
      "stateful": false,
      "evidenceMode": "direct_or_support",
      "notes": ""
    },
    {
      "type": "part_of",
      "layer": "micro",
      "kind": "semantic",
      "group": "ontology",
      "status": "canonical",
      "description": "source is a component of target",
      "sourceFamilies": [
        "MicroNode"
      ],
      "targetFamilies": [
        "MicroNode"
      ],
      "strength": null,
      "requiresScope": false,
      "stateful": false,
      "evidenceMode": "direct_or_support",
      "notes": ""
    },
    {
      "type": "has_part",
      "layer": "micro",
      "kind": "semantic",
      "group": "ontology",
      "status": "canonical",
      "description": "source contains target as a component",
      "sourceFamilies": [
        "MicroNode"
      ],
      "targetFamilies": [
        "MicroNode"
      ],
      "strength": null,
      "requiresScope": false,
      "stateful": false,
      "evidenceMode": "direct_or_support",
      "notes": ""
    },
    {
      "type": "belongs_to",
      "layer": "micro",
      "kind": "semantic",
      "group": "ontology",
      "status": "canonical",
      "description": "source is affiliated with, owned by, or assigned to target",
      "sourceFamilies": [
        "MicroNode"
      ],
      "targetFamilies": [
        "MicroNode"
      ],
      "strength": null,
      "requiresScope": false,
      "stateful": false,
      "evidenceMode": "direct_or_support",
      "notes": ""
    },
    {
      "type": "equivalent_to",
      "layer": "micro",
      "kind": "semantic",
      "group": "ontology",
      "status": "canonical",
      "description": "source and target are aliases or semantically equivalent",
      "sourceFamilies": [
        "MicroNode"
      ],
      "targetFamilies": [
        "MicroNode"
      ],
      "strength": null,
      "requiresScope": false,
      "stateful": false,
      "evidenceMode": "direct_or_support",
      "notes": ""
    },
    {
      "type": "performs",
      "layer": "micro",
      "kind": "semantic",
      "group": "participation",
      "status": "canonical",
      "description": "source actor executes the target method or action",
      "sourceFamilies": [
        "MicroNode"
      ],
      "targetFamilies": [
        "MicroNode"
      ],
      "strength": null,
      "requiresScope": false,
      "stateful": false,
      "evidenceMode": "direct_or_support",
      "notes": ""
    },
    {
      "type": "acts_on",
      "layer": "micro",
      "kind": "semantic",
      "group": "participation",
      "status": "canonical",
      "description": "source action or method operates on target object",
      "sourceFamilies": [
        "MicroNode"
      ],
      "targetFamilies": [
        "MicroNode"
      ],
      "strength": null,
      "requiresScope": false,
      "stateful": false,
      "evidenceMode": "direct_or_support",
      "notes": ""
    },
    {
      "type": "uses",
      "layer": "micro",
      "kind": "semantic",
      "group": "participation",
      "status": "canonical",
      "description": "source depends on or uses target as an input or tool",
      "sourceFamilies": [
        "MicroNode"
      ],
      "targetFamilies": [
        "MicroNode"
      ],
      "strength": null,
      "requiresScope": false,
      "stateful": false,
      "evidenceMode": "direct_or_support",
      "notes": ""
    },
    {
      "type": "produces",
      "layer": "micro",
      "kind": "semantic",
      "group": "participation",
      "status": "canonical",
      "description": "source creates, emits, or yields target",
      "sourceFamilies": [
        "MicroNode"
      ],
      "targetFamilies": [
        "MicroNode"
      ],
      "strength": null,
      "requiresScope": false,
      "stateful": false,
      "evidenceMode": "direct_or_support",
      "notes": ""
    },
    {
      "type": "targets",
      "layer": "micro",
      "kind": "semantic",
      "group": "participation",
      "status": "canonical",
      "description": "source is directed at target objective or object",
      "sourceFamilies": [
        "MicroNode"
      ],
      "targetFamilies": [
        "MicroNode"
      ],
      "strength": null,
      "requiresScope": false,
      "stateful": false,
      "evidenceMode": "direct_or_support",
      "notes": ""
    },
    {
      "type": "initiates",
      "layer": "micro",
      "kind": "semantic",
      "group": "event_structure",
      "status": "canonical",
      "description": "source triggers the start of target event",
      "sourceFamilies": [
        "MicroNode"
      ],
      "targetFamilies": [
        "MicroNode"
      ],
      "strength": null,
      "requiresScope": false,
      "stateful": false,
      "evidenceMode": "direct_or_support",
      "notes": ""
    },
    {
      "type": "involves",
      "layer": "micro",
      "kind": "semantic",
      "group": "event_structure",
      "status": "canonical",
      "description": "source event directly includes target participant or object",
      "sourceFamilies": [
        "MicroNode"
      ],
      "targetFamilies": [
        "MicroNode"
      ],
      "strength": null,
      "requiresScope": false,
      "stateful": false,
      "evidenceMode": "direct_or_support",
      "notes": ""
    },
    {
      "type": "occurs_at",
      "layer": "micro",
      "kind": "semantic",
      "group": "event_structure",
      "status": "canonical",
      "description": "source event is anchored at target time, place, or phase",
      "sourceFamilies": [
        "MicroNode"
      ],
      "targetFamilies": [
        "MicroNode"
      ],
      "strength": null,
      "requiresScope": true,
      "stateful": false,
      "evidenceMode": "direct_or_support",
      "notes": ""
    },
    {
      "type": "results_in_event",
      "layer": "micro",
      "kind": "semantic",
      "group": "event_structure",
      "status": "canonical",
      "description": "source event causes the target event to occur",
      "sourceFamilies": [
        "MicroNode"
      ],
      "targetFamilies": [
        "MicroNode"
      ],
      "strength": null,
      "requiresScope": false,
      "stateful": false,
      "evidenceMode": "direct_or_support",
      "notes": ""
    },
    {
      "type": "causes",
      "layer": "micro",
      "kind": "semantic",
      "group": "causality_and_condition",
      "status": "canonical",
      "description": "source causally produces target",
      "sourceFamilies": [
        "MicroNode"
      ],
      "targetFamilies": [
        "MicroNode"
      ],
      "strength": null,
      "requiresScope": false,
      "stateful": false,
      "evidenceMode": "direct_or_support",
      "notes": ""
    },
    {
      "type": "caused_by",
      "layer": "micro",
      "kind": "semantic",
      "group": "causality_and_condition",
      "status": "canonical",
      "description": "source is causally explained by target",
      "sourceFamilies": [
        "MicroNode"
      ],
      "targetFamilies": [
        "MicroNode"
      ],
      "strength": null,
      "requiresScope": false,
      "stateful": false,
      "evidenceMode": "direct_or_support",
      "notes": ""
    },
    {
      "type": "enables",
      "layer": "micro",
      "kind": "semantic",
      "group": "causality_and_condition",
      "status": "canonical",
      "description": "source makes target possible",
      "sourceFamilies": [
        "MicroNode"
      ],
      "targetFamilies": [
        "MicroNode"
      ],
      "strength": null,
      "requiresScope": false,
      "stateful": false,
      "evidenceMode": "direct_or_support",
      "notes": ""
    },
    {
      "type": "prevents",
      "layer": "micro",
      "kind": "semantic",
      "group": "causality_and_condition",
      "status": "canonical",
      "description": "source blocks, stops, or suppresses target",
      "sourceFamilies": [
        "MicroNode"
      ],
      "targetFamilies": [
        "MicroNode"
      ],
      "strength": null,
      "requiresScope": false,
      "stateful": false,
      "evidenceMode": "direct_or_support",
      "notes": ""
    },
    {
      "type": "requires",
      "layer": "micro",
      "kind": "semantic",
      "group": "causality_and_condition",
      "status": "canonical",
      "description": "source needs target as a prerequisite",
      "sourceFamilies": [
        "MicroNode"
      ],
      "targetFamilies": [
        "MicroNode"
      ],
      "strength": null,
      "requiresScope": false,
      "stateful": false,
      "evidenceMode": "direct_or_support",
      "notes": ""
    },
    {
      "type": "conditioned_on",